Section ID,QuestionNumber,Question ID,Question,Type,Parent ID,SubQuestionsFirst,CSSClass,Guidance10,Guidance5,Guidance0,WantConfidence,WantJustification,JustificationNote,HasPrivateNotes,WantExamples,Multiplier,OptionGuidance,Option0,Option1,Option2,Option3,Option4,Option5,Option6,Option7,Option8,Option9,Supporting0,Supporting1,Supporting2,Supporting3,Supporting4,Supporting5,HelpLink
LAND,,U.LAND.L-GEN-USE,To what extent is there evidence that land data is being used to influence policy in the interests of more equitable land tenure and use?,Status,,Yes,,,,,Yes,Yes,,Yes,Yes,,,,,,,,,,,,,,,,,,,https://handbook.globaldatabarometer.org/indicators/U.LAND.L-GEN-USE/
LAND,,U.LAND.L-GEN-USE.div-Existence,Existence,Note,U.LAND.L-GEN-USE,,divider,,,,,,,,,,,,,,,,,,,,,,,,,,,
LAND,,U.LAND.L-GEN-USE.a0,Is there evidence of this data being used to influence policy in the interests of more equitable land tenure and use?,Radio,U.LAND.L-GEN-USE,,radio-list,,,,No,,,,,1,,No evidence of actors or entities using this data to influence policy in the interests of more equitable land tenure and use.,There are isolated cases of actors or entities using this kind of data to influence policy in the interests of more equitable land tenure and use.,There are a number of cases of actors or entities using this kind of open data to influence policy in the interests of more equitable land tenure and use.,There are widespread and regular cases of actors or entities using this kind data to influence policy in the interests of more equitable land tenure and use.,,,,,,,"1,2,3; Please provide url of this use cases, and if there is any, inform what kind of stakeholders are using this data: -- -Academics -- -Civil Society Organisations -- -Journalists",,,,,,
LAND,,U.LAND.L-GEN-USE.div-Extent,Extent,Note,U.LAND.L-GEN-USE,,divider,,,,,,,,,,,,,,,,,,,,,,,,,,,
LAND,,U.LAND.L-GEN-USE.c0,Is there evidence that these uses are having meaningful positive impacts on land policy?,Radio,U.LAND.L-GEN-USE,,radio-list,,,,No,,,,,1,"Even though it is hard to link advocates´ actions to an effective policy change towards more equitable land tenure and land use, evidence could be tracked about policy updates after public debates and lobbying strategies.",No,Partially,Yes,,,,,,,,"1,2; Please provide urls to documentation of this evidence.",,,,,,
